request_idx,with_other_issue,primary_issue,request_id,therapist_id,variant,raw_match_score,apply_fit,apply_msg_len,rationale
43,1,relationship_issues,exp-req-043-678840,915967e3-ac56-4a36-8f02-effab988618f,C_generic_long,95,1.0,327,"Generic introduction that doesn't mention relationship issues, prior CBT experience, or warmth preference at all."
43,1,relationship_issues,exp-req-043-678840,54f8069d-9336-4d14-96b5-a692e3bf61f8,D_issue_specific,95,3.5,215,"Addresses the primary concern (relationship issues) and mentions collaborative approach which hints at warmth, but does not acknowledge their prior CBT experience or explicitly address the 'too clinic"
43,1,relationship_issues,exp-req-043-678840,30a94252-3cd0-42d1-a960-86def311f9e8,E_full_engagement,95,5.0,560,"Directly names relationship issues as focus, addresses warm style preference, and explicitly acknowledges the prior CBT experience feeling too clinical while positioning own approach as different."
44,0,life_transitions,exp-req-044-50ead3,d135e888-21b1-414b-90a5-2892b94c4ee8,A_empty,91,0,0,No apply message provided.
44,0,life_transitions,exp-req-044-50ead3,30a94252-3cd0-42d1-a960-86def311f9e8,B_oneliner,89,0,27,"The message is completely generic and fails to address any aspect of the patient's concerns, style preference, or therapy needs."
44,0,life_transitions,exp-req-044-50ead3,b4733156-b012-4a9a-81a7-2203f06c6f16,C_generic_long,89,1.0,327,"Generic introduction that invites consultation but does not mention life transitions, anxiety, or the patient's preference for a direct communication style."
44,0,life_transitions,exp-req-044-50ead3,563b2636-8018-444f-b347-8aae7f1442b9,D_issue_specific,89,3.5,212,"Addresses life transitions as a primary concern explicitly, but does not mention anxiety or the patient's preference for a direct style."
44,0,life_transitions,exp-req-044-50ead3,accc4ff3-675f-4894-9cd3-1feaeffb268e,E_full_engagement,87,5.0,361,
45,1,trauma_ptsd,exp-req-045-218b65,d135e888-21b1-414b-90a5-2892b94c4ee8,A_empty,68,0,0,No apply message provided.
45,1,trauma_ptsd,exp-req-045-218b65,9feb2fbe-6270-45af-ab07-60fa828314cb,B_oneliner,68,0,27,"Message is generic and does not address the patient's trauma/PTSD concerns, life transitions, structured preference, or prior CBT experience."
45,1,trauma_ptsd,exp-req-045-218b65,30a94252-3cd0-42d1-a960-86def311f9e8,C_generic_long,66,1.0,327,"Generic introduction that mentions 'what brings you in' only in passing without addressing trauma/PTSD, life transitions, structured preference, or prior CBT experience."
45,1,trauma_ptsd,exp-req-045-218b65,c5aa86f5-b6f4-4777-b3b9-f0b29baca9b6,D_issue_specific,66,2.5,207,"Mentions trauma/PTSD by name but ignores the life transitions concern, structured preference, and prior negative CBT experience entirely."
45,1,trauma_ptsd,exp-req-045-218b65,ea7c8499-17c1-432e-855a-f26458dfd4c7,E_full_engagement,66,5.0,552,"Directly names trauma/PTSD, addresses the prior CBT experience as too clinical, and offers a warm-but-structured alternative that fits the patient's needs."
46,0,trauma_ptsd,exp-req-046-6b8dac,723ac8d5-b667-4442-994d-4f65647c0e92,A_empty,90,0,0,No apply message provided.
46,0,trauma_ptsd,exp-req-046-6b8dac,d135e888-21b1-414b-90a5-2892b94c4ee8,B_oneliner,88,0,27,"Generic two-word message that doesn't acknowledge trauma/PTSD, style preferences, or prior therapy experience at all."
46,0,trauma_ptsd,exp-req-046-6b8dac,0390dbb1-87fb-4dcb-a529-53e47527063a,C_generic_long,87,1.0,327,"Generic introduction that doesn't mention trauma/PTSD, warm/structured preference, or acknowledge the prior therapy experience that didn't click."
46,0,trauma_ptsd,exp-req-046-6b8dac,07e66493-e3fc-4ab5-b871-e169e74e4c85,D_issue_specific,86,3.5,207,"Addresses the primary concern (trauma/PTSD) and mentions a collaborative approach which hints at warmth, but doesn't acknowledge their previous therapy experience or explicitly speak to their preferen"
46,0,trauma_ptsd,exp-req-046-6b8dac,3f84d00c-aea0-4051-9fce-41cc90be5972,E_full_engagement,86,5.0,554,"Directly names trauma/PTSD focus, explicitly addresses warm style preference, and acknowledges the college therapy experience that didn't click."
47,1,anxiety,exp-req-047-784094,723ac8d5-b667-4442-994d-4f65647c0e92,A_empty,91,0,0,No apply message provided.
47,1,anxiety,exp-req-047-784094,edcb82ab-1596-4040-80ec-6d80e2bd01b7,B_oneliner,90,0,27,"The message is a generic two-line response that does not acknowledge the patient's anxiety, PTSD, direct style preference, or therapy history in any way."
47,1,anxiety,exp-req-047-784094,30a94252-3cd0-42d1-a960-86def311f9e8,C_generic_long,89,1.0,327,"Generic introduction that doesn't mention anxiety, trauma/PTSD, direct style preference, or acknowledge the transition from couples to solo therapy."
47,1,anxiety,exp-req-047-784094,ea7c8499-17c1-432e-855a-f26458dfd4c7,D_issue_specific,89,2.5,203,"Mentions anxiety by name but does not address trauma/PTSD, the direct style preference, or acknowledge their lack of solo therapy experience."
47,1,anxiety,exp-req-047-784094,d135e888-21b1-414b-90a5-2892b94c4ee8,E_full_engagement,89,5.0,543,"Directly names anxiety, speaks to direct style preference, and explicitly acknowledges this being first solo therapy after couples work."
48,0,relationship_issues,exp-req-048-476fb1,d135e888-21b1-414b-90a5-2892b94c4ee8,A_empty,89,0,0,No apply message provided.
48,0,relationship_issues,exp-req-048-476fb1,a0cb7637-81de-46ec-85d0-8234c4dd3c92,B_oneliner,87,0,27,"The message is entirely generic and fails to address any of the patient's presenting concerns, therapy style preference, or prior therapy experience."
48,0,relationship_issues,exp-req-048-476fb1,b4733156-b012-4a9a-81a7-2203f06c6f16,C_generic_long,87,0.5,327,"Generic introductory message that doesn't mention any of the patient's specific concerns (relationship issues, depression, life transitions) or their preference for exploratory therapy."
48,0,relationship_issues,exp-req-048-476fb1,bf0c89f2-32b2-4ae8-b06d-b18ace4051d5,D_issue_specific,87,3.5,215,"Addresses the primary concern (relationship issues) directly and mentions a collaborative approach, but does not explicitly engage with the patient's exploratory style preference or acknowledge their "
48,0,relationship_issues,exp-req-048-476fb1,e0efc74f-45d2-4859-8f20-a6db128efe49,E_full_engagement,85,3.5,364,"Directly addresses relationship issues (primary concern) and acknowledges style preference by noting they lean less exploratory, but doesn't engage with prior therapy experience or how past success mi"
49,1,relationship_issues,exp-req-049-322575,edcb82ab-1596-4040-80ec-6d80e2bd01b7,A_empty,94,0,0,No apply message provided.
49,1,relationship_issues,exp-req-049-322575,a0cb7637-81de-46ec-85d0-8234c4dd3c92,B_oneliner,93,0,27,"The message is a generic two-word response that does not acknowledge the patient's relationship issues, warmth preference, or prior therapy experience in any way."
49,1,relationship_issues,exp-req-049-322575,54f8069d-9336-4d14-96b5-a692e3bf61f8,C_generic_long,93,1.5,327,"Generic introduction that doesn't specifically address relationship issues, warmth preference, or acknowledge their prior therapy experience that didn't help."
49,1,relationship_issues,exp-req-049-322575,d135e888-21b1-414b-90a5-2892b94c4ee8,D_issue_specific,93,3.5,215,"Directly addresses relationship issues as primary concern and mentions collaborative approach (somewhat warm), but does not acknowledge patient's prior therapy experience that didn't help."
49,1,relationship_issues,exp-req-049-322575,774a11fb-6558-433b-8df2-6ebf0c120279,E_full_engagement,93,5.0,474,"Directly names relationship issues as her focus, addresses the warm style preference, and explicitly acknowledges prior therapy not helping by offering to explore what was missing."
